"There's no a better gifts in this world than a book about Hitler. So thank you so much. I I've gotten a gift when I was what we're just talking about flying the watch from Joe Rogan and this almost feeds it. So, so tell me what this particular book on Hitler is. So this is volume two."
"Do you think he was born this way, that charisma, whatever that is, or was it something he developed strategically? That's like the question you apply to some of the great leaders. Was he just a mad man who had the instinct to be able to control people one in the room together with them? Or is this like,"
"And also he was able to convince the generals and military. I mean, that was, that was very interesting. And to convince Chamberlain and the other political leaders, there's, that's something I often think about. Cause we just reading books about these people. I think about what, like Jeffrey Epstein, for example. Oh yeah. Like evil people, not evil. People have done evil"
"Things. Let's not go to the Dan Carlin people that do evil things. I wonder what they like in a room, because I know quite a lot of intelligent people that were, did not see, did not see the evil in Jeffrey Epstein and spend time with them. And not, we're not bothered by in the same sense Hitler. It seems like he was able to get just even on it before he had power because people get intoxicated by power and so on. They want to be close to power. But even before he had power, he was able to convince people and it's unclear."
"Like, is there something that's more than words? It's like the way you, I mean, people talk, tell stories about like this piercing look and whatever, all that kind of stuff. I, I wonder if that, if that's somehow part of it, like that has to be the base for, of any of these charismatic leaders, you have to be able to in a room alone, be able to convince anybody of anything."
I wonder if that was a different person because you were recording then offline.
"For me. So he's really aware of the narratives of story. I mean, that people have talked about that all comes from the tabloid media of the, from New York and so on. He's a master of that, but I've also heard stories of just in private. He's a really, I don't want to overuse the word charismatic, but just like, he is a really interesting, almost like friendly, like a good person. Like, like that's what I heard a, I haven't heard actually surprising the same thing about Hillary Clinton. And like, I can't tell you, but like the, the way they present themselves is perhaps very different than they are as human beings."
"One-on-one that, that's something maybe that's just like a skill thing. Maybe, maybe the way they present themselves in public is actually they're they're I mean, almost their real self. And they're just really good in private one-on-one to go into this mode of just being really intimate in some kind of human way."
"That's awesome. Great apologetic. He's like, you guys want a diet Coke."
"It's like, you are your own, like, life is great."
"He believes that he, what, what, he kind of implies that he is one of, if not the greatest presidents in American history, like people kind of laugh at this, but there's quite, I mean, there's quite a lot of people, first of all, that make the argument that he's the greatest president in history. Like I've heard this argument being made. And I mean, I don't know what the, first of all, I don't care. Like you can't make an argument that anyone is the greatest. That's just, that's just, I, I come from a school of like being and modest and so on. If they give him Michael G you can't have that conversation."
"Okay. So I like the he's humble enough to say like, yeah,"
"Do you think he actually believes that? Or is that something he understands will create news and also perhaps more importantly, piss off a large number of people. Is he almost like a musician masterfully playing the motions of the public or does he well, or, and does he believe when he looks in the mirror? I'm one of the greatest men"
"It's an interesting question. Whether knowing history, being a student of history is, is productive or counterproductive. I tend to assume I really respect people who are deeply like well-read in history, like presidents that are almost like nerd history nerds. I admire that. But maybe that gets in the way governance. I don't know. It's not, it's not, you know, I'm just sort of playing devil's advocate to my own beliefs, but it's possible that focusing on the moment and the issues and letting history, it's like first principles thinking, forget the lessons of the past and just focus on common sense of reasoning through the problems"
"Yeah. That's I think is really interesting. Speeches were amazing. I'm also a sucker for great speeches because I I'd done to see the role of the president as impart, like inspire and chief sort of to be able to, I mean, that's what great leaders do, like CEOs of companies and so on, establish a vision, a clear vision, and like, like hit that hard. But the way you establish the vision, isn't just like not to dig at Joe Biden, but like, like sleepy, boring statements, you have to sell those statements and you have to, you know, you have to do it in a way where everybody's paying attention."
"Everybody's excited. Yeah. And that Teddy was, was definitely one of them. Obama was that I think at least early on, I, I don't know, was incredible at that. It does feel that the modern political landscape makes it more difficult to be inspirational in a sense because everything becomes bickering and division. I do want to ask you please about Trump. So you're now a successful podcaster. I've talked to Joe about Trump, Joe Rogan. And Joe's not interested in talking to Trump. It's just fascinating. I try to dig into like, why, what would you interview Trump on like realignment, for example."
"And do you think it's possible to do a two, three hour conversation with him where you will get at something like human or you get something like we were talking about the facade he puts forward. Do you think you'd get, get past that? No, I don't."
"I think he's a different human now after the election, do you think that"
"Yeah. He's a fascinating study. I still, I feel there's a hope of me that there'll be a podcast, like, like a Joe Rogan, like a long form pockets where it's something could be, you know, and you're actually a really good person to do that where you can have a real conversation that looks back at the election and reveal something on us. But perhaps he's thinking about running again. And, and so maybe he'll never let down that guard. Yes. But like, you know, I, I just love it when there's this switch in people where you start, start looking back at your life and wanting to tell stories, like, you know, trying to extract wisdom and like realizing you're in this new phase of life or like the battles have all been fought now you're this old, like former warrior."
"And now you can tell the stories of that time. And it seems like from it's still at it, like the young warrior he is, he's not in the mode of telling stories"
"Amazing Avenue, he almost gotten stronger and he was one of the most diverse, like the climate there's so many people attacking him so much hatred, so much love and hatred. And it was just, it was, I mean it was whatever it was, it was a quite massive phone and, and a fascinating study. I, if we, if we stick on Hitler for just a minute, what lessons do you take from that time? Do you think it's a unique moment in human history, the world war II. I mean both Stalin and Hitler, you know, is, is it something that's just an outlier in all of human history in terms of the atrocities or is there the lessons to be learned?"
"You mentioned, mentioned offline that you're not just a student of the entirety of the history, but you're also fascinated by just different like policies and stuff. Like what's the immigration policy, what's the policy on science,"
"Yeah. I mean, sometimes it's hard to predict what kind of outcomes will result from the incentive, the system that you create. Right. Right. And the case, because especially when it's novel kind of situations, when Trump likes you created a pretty novel situation and a lot of the things that we've seen in the 20th century or very novel systems where people are very optimistic about the outcomes, right. And then it turned out to not have the results that they predicted. I, in terms of like things being unchanged for the past hundred years and so on, can you like Wikipedia style or maybe like in, in a musical form, like I'm only a bill described to me."
"I don't know what the rest of the song goes, but let's, let's leave that to people's imagination. How, how does this whole thing work? How does the U S political system work? The three branches is, how do you think about the system we have now, if you were to try to describe if aliens showed up and asked you, like they didn't have time, so this is an elevator thing. Should we destroy you and B as you plead to avoid destruction, well, how, how would you describe how this thing works? I would say"
"That's how I would describe it. So the,"
"So there's a balance of power that's because it's multiple branches, there's a tension and a balance to it as designed by those original documents. What, which is the most dysfunctional, the branches, which is your favorite, like in terms of talking about systems and like what's the greatest of concern and what is the greatest source of benefit in your view?"
"Do you think at this point, the model power that the president has is corrupting to the, to their ability to lead well, is this is, you know, power corrupts, absolute power corrupts. Absolutely. Are we, is there too much power in the, in the presidency?"
"Deep state, I guess, has conspiratorial detentions to it. But so what you're saying is the true power currently lies with the autopilot. Yeah. K deep state."
"Well, listen for me personally, but also from an engineering, I just talked to Jim Keller is just, this is the kind of bullshit that we all hate in when you're trying to innovate and design new products, right? So like that's the, that's what first principles thinking requires. It's like, we don't give a shit. What was done before the point is what is the best way to do it? And it seems like the current government government in general, probably bureaucracies in general are just really good at being lazy about never having those conversations and just, it becomes this momentum thing that nobody has, the difficult conversations."
"It's become a game within a certain set of constraints and they never kind of do revolutionary tasks. But you did say that the presidency has power, but you're saying that more power than the others. And that power has to be coupled with like focused intentionality. Like you have to keep hammering the thing"
"Okay. That's really fast. And you make me realize that actually both Obama and Trump are probably playing here to the system. You're making me think that maybe you can correct me that because I'm thinking of like Elon Musk, who's major success, despite everything is, is hiring the right people. Exactly. And like creating those thousands, that structure of a thousand people. So maybe a president has power in that. If there were exceptionally good at hiring the right people,"
"Are you able to steer the ship way more than two degrees if you hire the right people? So like, it's almost like a Walmart was not good at hiring the right people,"
"Back and say, Oh, president can't. But that means you're just suck at hiring."
"What role does money play in all of this as money, huge influence in politics, super PACS, all that kind of stuff, or is this, is this more just kind of a narrative that we play with? Because from the outsider's perspective, it seems to have, that seems to be one of the fundamental problems with modern policy."
"So that's interesting. So it was one. So in that sense, representative government has done a pretty good job of representing the state of culture and the people and so on. Yeah. Can I ask you in terms of, you know, the deep state and conspiracy theories, there's a lot of talk about, again, from an outsider's perspective. If I were just looking at Twitter, it seems that at least 90% of people in government are pedophiles and then 90, 90, 95%. I'm not sure what that number is. If I were to just look at Twitter, honestly, or YouTube, I would think most of the world's a better file. I would almost feel like right."
"A pedophile, I would start to wonder like, wait, like, what am I a pedophile to? I'm either a communist or a pedophile or both, I guess. Yeah. That's going to be clipped up. Thank you, internet. I look forward to your emails, but is there any kind of shadow conspiracy theories that give you pause or sort of the flip side, the response, a lot of conspiracy theories. It's like, no, the reason this happened is because it's a combination of just incompetence. So where do you land on some of these conspiracy areas?"
I think most
"And we don't know which ones, I don't know which one that's the problem."
That's all I have to say. That's it. I have the sense that the government
"Has information hasn't revealed, but it's not like they're, I don't think they're holding. There's like a green guy sitting there in a row. Cause they just, they have seen things. They don't know what to do with the so it's like, they're confused. I guess you're"
"It's revealing exactly that they don't know. And then they're in the process. There's a lot of fierce tied up in that first looking and competent in the public eye. Nobody wants to be looked that way. And the other is like in revealing it, even though they don't know, maybe China will figure it out. Exactly. So like, we don't want China to figure it out first. And so that all those kinds of things result in basically secrecy, then that damages the trust in institutions on one of the most fascinating aspects. Like one of the most fascinating mysteries of humankind of is there life intelligent life out there in the universe. So that's one of them, but there there's other ones, like for me, when I first came across, actually Alex Jones was a nine 11."
"I remember like, cause I was, I was in Chicago. I was thinking like, Oh shit, are they going to hit Chicago too? That's where everybody was thinking, yeah, everybody, everybody was thinking like, what does this mean? It's get what scale, what? I mean, trying to interpret it. And I remember like looking for information that's but like what, what happened? And I remember not being satisfied with the quality of reporting and figuring out like rigorous, like here's exactly what happened. And so people like Alex Jones stepped up and others that said like, there's some shady shit going on and it sure as hell look like there's shady shit going on. So like, and I still stand behind the fact that it seems like there's not, there's not enough."
"Like it wasn't good job of being honest and transparent and all those kinds of things,"
"Yeah. So th those kinds of conspiracy theories are interesting. I mean, there's other ones for me personally, that touched a sort of institution. That means a lot to me is MIT and, you know, Jeffrey Epstein."
"Eric Weinstein, I've heard is right. Oh boy. So I listen, I'm still in. And Eric is fascinating and like arrogance full on saying that he was a Mossad or whatever. Yeah. There's something, something much, much bigger. And there's, whatever his name, Robert Maxwell, all the, all those stories is like, you could dig deeper and deeper that the Jeff is just like the tip of the iceberg. I just think he's an exceptional charismatic, listen, this isn't speaking from confidence or like deep understanding of the situation. But from my speaking with people, he's just seems like, at least from the side of his influence and interaction with researchers, he just seems like somebody that was exceptional charismatic and actually took interest."
"He was unable to speak about interesting scientific things, but he took interest in them. So he knew how to stroke the egos of a lot of powerful people, like, well, like in, in different kinds of ways, I suppose I don't know about this because I don't have like, if a really, okay, this is, this is weird to say, but I have an ability. Okay. I think women are beautiful. I like women. But like if, if like a supermodel came to me or something like, it's like, I'm able to reason, it seems like some people are not able to think clearly when there's like an attractive woman in the room."
"And I think that was one of the tools he used to manipulate people. Interesting. I don't know, listen to like the pedophile thing. Right. I don't know how many people are complete sex addicts, but like, it seems like what, like looking out into the world, like there's a, like the me too movement have revealed that there's a lot of like weird, like creepy people out there. I don't know. But I think it was just one of the many tools that he used to convince people and manipulate people, but not in some like evil way, but more, just really good at the art of conversation."
"Yeah. And just winning people over on the side. And then by building through that process, building a network of other really powerful people and not explicitly, but implicitly having done shady shit with powerful people. Yeah. Like building up a kind of implied power of like, like we did some shady shit together. So we're not like you're going to help me out on this extra thing I need to do now. And that builds and builds and builds to where able to actually control, like have quite a lot of power without explicitly having like a strategy meeting."
"And I think a single person, or yeah, I think a single person can do that. Can start that ball rolling. And over time it becomes a group thing. Like, I don't know if Julie Maxwell's involved or others and yeah, over time that becomes almost like a really powerful organization that wasn't, that's not a front for something much deeper and bigger, but it's almost like maybe it's cause I love cellular automata man, a system that starts out as a simple thing with simple rules can create incredible complexity. Yes. So I just think that we're now looking in retrospect, it looks like an incredibly complex system that's operating in, but like that's just because it's, you know, there could be a lot of other Jeffrey Epstein's in, in my perspective that the simple thing just was successful early on and builds and builds and builds and builds."
"And then there's a creepy shit that like a lot of aspects of the system helped it get bigger and bigger and more powerful and so on. So the final result is, I mean, listen, I'm, I have a pretty optimistic, I have a, I tend to see the good in people. And so it has been heartbreaking to me in general, just to see, you know, people I look up to not have the level of integrity I thought they would, or like the strength of character, all those kinds of things. And it seems like you should be able to, to see the bullshit that is Jeffrey Epstein. Like when you meet them. Right. We're not talking about like Eric Weinstein, like one or two or three or five interactions, but like there's people that had like, like years of relationship with them."
"Yeah. And I don't know. I, I'm not sure when, after he was convicted, after he was convicted. Yeah. There's there's stories. I mean, I don't need to sort of, I honestly believe, Okay. Here's the open question I have. I don't know how many creepy sexual people that are out there. I don't know if there's like, like the people I know the faculty and so on. I don't know if they have like a kink that I'm just not aware of. That was being leveraged. Because to me, it seems like if, if, if people aren't, if not everybody's a pedophile, then it's just the art of conversation that is just like the art of just like manipulating people by making them feel good about like the exciting stuff they're doing."
"Listen man, academics or people talk about money. I don't think academics care about money. As much as people think, what they care about is like somebody, they, they, they want to be a, it's the same thing that Instagram models posting their, but pictures is they want to be loved. They want attention and"
"They, they, and Jeff has seen the money is another way to show attention. Right. It's my work matters. And, and, and he, for some, he did that for some of the weirdest, most brilliant people. I don't want to sort of drop names, but everybody knows them. It's like people that are the most interesting academics is the one he cared about. Like people are thinking about the most difficult questions of, in all of science and all of engineering. So those people are, were kind of outcasts in academia a little bit because they're doing the weird shit. They're the weirdos. And he cared about the weirdos and he gave them money."
"And that, you know, that's, I don't know if there's something more nefarious than that. I, I hope not, but maybe I'm surprised. And in fact, the half, the population of the world is pedophiles."
"Signs that make you think that there's a bigger thing at play than just the man that there's some, it does look like a large organization is using this front."
"He's always the problem with that. That's probably why I hesitate to touch conspiracy theories is because I'm allergic to certainty in all forms, in politics, in any kind of discourse and people are so sure in both directions, actually, it's kind of hilarious either. They're sure that the conspiracy theory, a particular, whatever the conspiracy theories is false. Like they almost dismiss it. Like, like they, they don't even want to talk about it. It's like the people, like the way they dismiss that the earth is flat. Yes. Most scientists are like, they don't even want to like hear what the, what the flat earth is the saying. They don't have zero patience for it, which is like that maybe in that case he's deserved."
"But everything else you really like have empathy, like consider the F you have, okay, this is weird to say, but I feel like you have to consider that the earth might be flat for like one minute. Like you have to be empathetic. You have to be open-minded."
"Do you think when you go, when you dig to the core, there is a big, there's a big gap between left and right. Is there, is that division that that's perceived currently real or most people look center-left and center-right,"
"But it seems like, so that's fascinating. Conversation is different than the policies."
"So it's more, it's more just red and blue deck teams. They're arbitrary teams. Are they, so how arbitrary are these teams, I guess is another completely"
"Of imply that there's, I don't know if you're sort of in post analyzing the patterns, because it seems like there's a network effects of like, you just pick the team red or blue and it might have to do with college. You might have to do all of those things, but like, it seems like it's more about just the people around you. Correct. So less than whether you went to college or not, I mean, it's almost like, it seems like it's almost like a weird, like network effects that heart there's certain strong patterns you're identifying, but I don't know. It's sad to think that it might be just teams that have nothing to do what you actually believe."
What's wrong with that prediction.
"So this is interesting. If you could just psychoanalyze again, probably naive about this, but I'm really bothered by the hatred of liberals. It's, isn't this amorphous monster that's mocked. It's like the Shapiro, a liberal tears. And I'm also really bothered by probably more of my colleagues and friends. The hatred of Trump. Yeah. The, the Trump and, and white supremacist. So apparently 70 there's, 70 million white supremacists, 75 million, sorry."
"There's millions of white supremacists and apparently whatever liberal is. I mean, you know, literally liberal has become equivalent to white supremacist in the power of negativity at arouses. I don't even know what those, I mean, honestly, I just don't, they've become swears essentially. Is that, I mean, how do we get out of this? Because that, that's why I just don't even say anything about politics online. Cause it's like, really? Like you, you can't, you here's what happens? Anything you say that's like thoughtful, like, Hmm."
"I wonder the immigration, something like, I wonder like why, you know, we have these many, we allow these many immigrants in, or the some version of the like thinking through these difficult policies. And so they immediately tried to find like a single word in something you say that can put you in a bin of liberal or white supremacists and hammer you to death by saying you're one of the two. And then everybody just piles on happily that we finally nailed this white supremacist or liberal. And that is this some kind of weird like feature of online communication that we've just stumbled upon."
"Is there a way, or is it possible to argue that this is like a feature, not a bug? Like this is a, a good thing."
"Why? So this is everything you're saying. Makes perfect sense. Like take, yeah. It's like, it's like, again, if the aliens showed off, it's like the obvious thing to do is like, what's the popular thing. Like 80% of Americans support this, like do that clean also do it like with like grace, where you're able to bring people together, not like in a political way, but like obvious, like obvious, common sense way. Like just people, the Republicans and Democrats is bringing them together on a policy and like bold. Just hammer it without the dirt, without the mess, whatever, try to compromise."
