"Yeah. But at the same time, being naive, really optimistic about everything is also a kind of <inaudible> people are going to fuck you over. And more importantly, that doesn't bother me more importantly, you're not going to be able to reason about how'd you create systems that are going to be robust to corruption, to a malevolent like parties. So in order to create, you have to have a healthy balance of both, I suppose, especially if you want to actually engineer things that, that work in this world that has evil in it. Right. I can't believe there's a book of Hitler on desk. We've mentioned a lot of books throughout this conversation. I wonder. And this makes me really curious to explore in a lot of depth, the kind of books that you're interested in."
"I think you mentioned your show that you, you provide recommendations. Yes I do. In the form of spoken word, can you be on what we've already recommended, mentioned books, whether it is historical nonfiction or whether it's more like philosophical or even fiction that had a big impact on your life. There, is there a few that you can mention? Sure."
Okay. Can I ask you a question about those books? Yes. What the hell do you fit into so many pages? Everything.
"First of all, I'm gonna, you know, I'm going to take this part of the pocket. I'm gonna set it to music when I listen to it. Cause I've been whining and bitching about running 40 miles of Goggins this next weekend. And this is, this is gonna be so easy. I'm just going to listen to this over and over in my head, you're"
About them all the time he uses. I was going
"To ask you about the use as an example of that is a as an example of what Mars colonization,"
"Like, what is it? Is it like simulating the experience of what it would be like?"
"Absolutely history remembers the ones who didn't eat each other. Yeah. We re well, yeah, we remember the ones. Yeah."
"The story of Mars as well will be the story far. So, but nevertheless, that's the interesting thing about on target. Nevertheless, something about human nature drives us to explore it. Yes. And that seems to be like, you know, a lot of people have this kind"
"Of, to me, frustrating conversations like, well, earth is great, man. Why do we need to call them as Mars? Like you just don't get it. I don't know. I mean, I don't know. It's the same people that say like, why are you running? Like, why are you running a marathon? What are you running from, man? I don't know. It's pushing the limits of the, of the human mind of the, of what's possible Mallory because it's there. Yeah. Simple. And that, and that's somehow actually the result of that, if you want to be pragmatic about it, there's something about pushing that limit that has side-effects that you don't expect that will create a better world back home for the people, not necessarily on earth, but like just in general, it raises the quality of life for everybody, even though the initial endeavor doesn't make any sense."
"The very fact of pushing the limits of what's possible then has side effects of benefiting everybody. And it's difficult to predict ahead of time or what those benefits will be say with colonizing Mars. It's unclear what the benefits will be for earth or in general,"
That's how I would put it. He should run for president.
"Doing difficult things and pushing, exploring the world in all of its forms. I hope that kind of spirit permeates politics to that same kind of, well, it can,"
"And I hope so. I don't know if you want to stay on it, but I think that was book number one or two shit. All right. Is there"
"I agree with you a hundred percent. I I'm ashamed to, I usually don't bring up sapiens because it's like, yeah, it's like, uncle's rented, but yeah, that's a good thing. It is one of the, I think it will be remembered as one of the great books of this particular era. Yeah. Because it's, it's so clearly it's like the selfish gene with Dockers. I mean, it just aggregates so many ideas together and puts language to it. That's makes it very useful to talk about. So it is one of the great books."
"Which is that I'm just going to listen to this whole podcast next week. You got to,"
"You found us somehow to, to our true nature. Yeah."
"Yeah. Not, I wouldn't be very good at it, but like, I'm so glad that somebody that who thinks deeply about politics is so fascinated with exploration and with the very basic nature, like human nature, nature of our existence. I love that. There's something in you and still you're stuck in DC for now, for now. Speaking of which the you're from Texas. Yes. What do you make of the future of Texas politically, culturally, economically. I am in part moving well, I'm moving to Austin grass, but I'm also doing the Eric Weinstein advice, which is like, dude, you're not married."
You don't have kids. There's no such thing as moving.
"You're like, like your three suits and some shirts and underwear. What exactly is the move entail? So I have nothing. So I'm basically, you know, it's very, just remain mobile, but there's a promise. There's a hope to Austin outside of, I mean, my outside of just like friendships, I have no, it's a very different culture that Joe Rogan is creating. I'm mostly interested in the what the next Silicon Valley will be, what the next hub of technological innovation. And there's a promise, maybe a dream for Austin being the next place that possible. It doesn't have the baggage of some of the political things."
"Maybe some of the sort of things that hold back. The beauty of that makes capitalism that makes innovation so powerful, which is like a meritocracy, which is excellence. Diversity is exceptionally important, but not, it should not be the only priority. It has to be something that it co-exists with, like insatiable drive towards excellence. And it seems like Texas is a nice place like having Austin, which is like a kind of this weird. I hope it stays weird, man. I love weird people."
"We can get it, but it's, there's this hope is it remains this weird place of brilliant innovation. It's the, a state that's like more conserved. So like there's a nice balance of everything. What are your thoughts about the future of Texas?"
"Joe, I'm going to say,"
"You're ultimately another human being than the one who left Texas. Yeah. So, I mean, have you actually considered moving to Texas and broadly just outside of your own story, what do you think is the future of Texas was a feature of Austin? Yes. There's so much transformation seemingly happening now related to Silicon Valley, live California"
"Perspective. Well, first of all, I love some of the, the cowboy things that Texas stands for more practically, from my perspective, the injection of the tech innovation, right. That's moving to Texas has made it very exciting to me. It seems like outside of all that maybe you can speak to the weird in Austin. It seems like I know that Joe Rogan is a rich sort of almost like mainstream at this point. Right. But he's also attracting a lot of weirdos and so Ilan and a lot of those weirdos of my friends and they're like, like Michael malice, like those weirdos."
"And it's like, I have a hope for Austin that all kinds of different flavors of weirdos will get injected."
Money on the entertainment. Exactly. You
"But no matter what, you know, a new place allows the possibility for new ideas, even if they're somehow left-leaning and all those kinds of things. I do think the only two things missing from Austin and Texas are a two dudes in a suit that sometimes have a podcast talk a bunch of nonsense and a mic. So let's, let's bring the best suit game to"
"The following is a conversation with Ronald Sullivan, a professor at Harvard law school known for taking on difficult and controversial cases. He was on the head legal defense team for the Patriots football player, Aaron Hernandez, and his double murder case. He represented one of the genus six defendants and never lost the case during his years in Washington, DC's public defender services office in 2019, Ronald joined the legal defense team of Harvey Weinstein, a film producer facing multiple charges of rape and other sexual assault. This decision met with criticism from Harvard university students, including an online petition by students seeking his removal as faculty Dean, a winter palace, then a letter supporting him signed by 52 Harvard law school."
"Professors appeared in the Boston globe on March 8th, 2019. Following this the Harvard administration succumbed to the pressure of a few Harvard students and announced that they will not be renewing Ronald solvent Dean position. This created a major backlash in the public discourse over the necessary role of universities in upholding the principles of law and freedom at the very foundation of the United States. This conversation is brought to you by Brooklyn and sheets, wine access, online wine store, monk pack, low carb snacks and Blinkist app that summarizes books click their links to support this podcast."
"As a side note, let me say that the free exchange of difficult ideas is the only mechanism through which we can make progress. Truth is not a safe space. Truth is humbling and being humbled can hurt, but this is the role of education, not just in the university, but in business and in life. Freedom and compassion can coexist, but it requires work and patience. It requires listening to the voices and to the experiences, unlike our own listening, not silencing, I'll do a few minutes of ads now and no ads in the middle. I tried to have fun with these, even though my voice is genetically incapable of sounding like I'm having fun."
"I do give you timestamps. So go ahead and skip. If you do not happen to have the patience of a Saint, but I do try to make it. So there are at least like somewhat interesting to listen to, but either way, please do click the links in the description for the sponsors. It really is the best way to support this podcast. This episode is sponsored by booklet and sheets. I am not an expert on comfort. I've often throughout my life, slept on the carpet without anything but a jacket and jeans, but these sheets have been amazing in general. For many years, I've mostly lived a minimus life in the things that eat in the content I consume in the possessions that actually have material possessions in the things that have hung up on my wall, which is usually nothing except maybe a picture of firemen and Einstein."
"And when you have a minimalist life like that, you could really appreciate quality. I think there's two kinds of products. Of course, it's a Venn diagram, but the first category is the ones you get to show to the world. And the other is the ones you get to make yourself feel happy like internally intrinsic versus extrinsic. I guess again, it's probably a significant overlap, but I do appreciate quality. I do appreciate products that make me feel good. These sheets are that. So it's nice. I will never be dependent on these things. If I do feel myself becoming dependent, I will let go of them."
"Anyway, go to Brooklyn and.com and use code Lex to get twenty-five bucks off. When you spend a hundred dollars or more, plus get free shipping as Brooklyn and.com and enter code Lex. This podcast is also sponsored by wine access online store with expertly selected wine. They make it easy for anyone I E me from novice to expert to pick and order the most delicious wines from around the world. Their team tastes over 20,000 bottles a year and handpicks only the best for their customers. There's something profoundly joyful about me imagining the tasting of 20,000 bottles."
"I personally had a lot of joyful experiences drinking wine because at least for me, one has been a thing that brings close friends and family together over a great meal. So I kind of think there's several categories of alcohol. Wine is like a ball sharing love with friends. And then there's like the other side of the spectrum, which is tequila, where every single experience of had or tequila was involved. I've regretted. So if you choose wine, it's choosing love. If you choosing tequila, you're choosing danger, but sometimes a little dangerous, fun. So, but most of the time you want to stick with wine. You want to stick with wine access."
"Let me recommend. This is where I try to sound smart and sophisticated. The 2018 radio silence Cabernet Sauvignon, Napa Valley is definitely a good one. And it's affordable given the high, high quality. So get 20% off your first order. When you go to wineaccess.com/lex, the discount will be applied at checkout that's wine, access.com/lex to see my wine picks and to get this discount. And I hope you and I, dear listener, we'll share wine together. One day, this episode is also brought to you by monk pack, Quito granola bars that contains just one gram of sugar, two grams of net carbs."
"And there are only 140 calories. It's actually interesting to think about what kind of fuel is needed when you're on the low carb diet, when you all of a sudden step up the performance needs. So like, if I usually run, you know, five or six miles here and there do a few pushups and pull-ups and so on, if I all of a sudden have to run like an ultra marathon, which I hope I don't have to, but I very well might need to. Once I meet David, there's quite a few people that say you can do the ultra on continuing low carb, like ultra low carb, but there's also a lot of people that say, well, no, in these cases, even if you eat low carb, you need to load up on carbs, all that stuff."
"There's so many debates. There's so confusing. I don't know what to make of it. I think I go back to the same thing I would go back to, which is you have to experiment on yourself and you have to listen to your body. Like don't listen to a random guy on the internet, listen to your body over that. Okay. Get 20% off your first purchase of any monk pack product by visiting monk pack.com and enter code Lexa checkup. If you don't like it for any reason, I would personally first question your tastes, but monk back will not they'll exchange the product or refund your money guaranteed. That's monk back.com and enter code."
"Lex. This episode is also supported by Blinkus my favorite app for learning new things. Blink is takes the key ideas from thousands of nonfiction books and condenses them down into just 15 minutes they can read or listen to. They've also started doing this weirdly amazing thing called short casts, which summarizes podcasts. They have like a selection of podcasts and they summarize them. The ones they choose. They're like the really well organized podcasts, but it's kind of fun to think about them trying to summarize like this podcast that I'm doing, or even like the crazier long form podcast, like a Joe Rogan experience, kind of buckets. Good luck trying to summarize that chimps, DMT and aliens."
"There you go. That's a summary. I should work for Blinkist. I really actually enjoy this idea of hardcore summarization. Like some people listen to podcasts like two weeks or even more faster. Like there's a lot of value to that. Or even just like with Blinkist summarizing books that are like huge into just like a few pages. I really think that's exceptionally valuable, but it also has to be coupled with actually reading long form content or listening to long form content as well. And I actually think there's space to listening to stuff at like one X and pausing and giving your mind a chance to think. I really think there's power in silence."
"You know, you can call the boredom or whatever, but it's that meditative silence that you want to escape. There's an anxious desire to escape that silence. But if you resist that anxious desire, I brilliant ideas"
"Come. So that's the value of long form content. But then the short form content is really valuable because you get condensed information. So you're maximizing on information with long form content you're maximizing on the silence and the chance to think anyway, go to blinkist.com/lex to start your free seven day trial and get 25% off of Blinkist premium membership. That's blinkist.com/lex. This is the Lex Friedman podcast, and here is my conversation with Ronald Sullivan."
"We're one of the lawyers who represented the Hollywood producer, Harvey Weinstein in advance of a sexual assault trial for this Harvard forced you to step down as faculty deans, you and your wife, winter palace. Can you tell the story of this saga from first deciding to represent Harvey Weinstein to the interesting complicated events that followed?"
"Is there a philosophy behind you taken on these very difficult cases? Like, is it a set of principles? Is it just your love of the law or is it, is there a set of principles? Why you take on the case?"
"As from a psychological perspective, just you as a human. Is there, is there a fear, is there a stress from all the pressure? Cause if you're facing, I mean the whole point, a difficult case, especially in the latter that you mentioned of the going against popular opinion, you have the eyes of millions potentially looking at you with anger, as you try to defend, you know, this, these set of laws that this country is built on."
"So one of the hardest cases of recent history would be the Harvey Weinstein in terms of popular opinion or unpopular opinion. So, well, if you continue on that line or what was that, where does that story take you of taking on this case?"
Teach teaching moment. Yeah. Very important teaching moment. So they they've forced you to step down from that faculty Dean position at the house.
"Day, release it, release"
"That seems like a Seminole mistake by Harvard and Harvard is one of the great universities in the world. And so sort of its successes and its mistakes are really important for the world as a beacon of like what, how we make progress. So what lessons for the bigger academia they get, that's under fire a lot, these days of what bigger lessons do take away. Like how do we make Harvard great. How do we make other universities, Yale, MIT, great in the face of such mistakes?"
"So, I mean, what does it kind of boils down to is just having difficult conversation, difficult debates when you mentioned a sort of 19 year olds, and it's funny, I've seen this even at MIT. It's not that they shouldn't have a voice. It should sh they,"
"They do seem to, I guess you have to experience it and just observe it. They have a strangely disproportionate power, right. It's very interesting to, to basically, I mean, you say, yes, there's great faculty and so on, but you know, it's not even just that the faculty is smart or wise or whatever, it's that they're just silenced. So the terminology that you mentioned is weaponized as a sort of safe spaces or that certain conversations make people feel unsafe. What do you think about this kind of idea, you know, is, is, is there some things that are unsafe to talk about in a university setting?"
"Is there a lines to be drawn somewhere? And just like you said, on the flip side with a slippery slope, is it too easy for the lines to be drawn everywhere?"
"And I, I think there needs to be a mechanism outside of the space of ideas of humbling. I got, I've done martial arts for a long time. I got my ass kicked a lot. I think that's really important. I mean, the, in the space of ideas, I mean, even just in engineering, just all the math classes, my memories of math, which I love is it's kind of pain is basically coming face-to-face with the F with the idea that I'm not special, that I'm much dumber than I thought I was. And that anything accomplishing anything in this world requires really hard work."
"That's really humbling that makes you that, that puts you. Cause I remember when I was 18 and 19 and I thought I was going to be the smartest, the best fighter, the Nobel prize, winning, you know, all those kinds of things. And then you come with the face to face with the reality and it hurts. And it feels like there needs to be efficient mechanisms from the best universities in the world did without abusing"
"You. It's a very difficult line to walk without like mentally or physically abusing you be able to humble you. And that's what I felt was missing in these very difficult, very important conversations is the 19 year olds when they spoke up the mechanism for humbling, them with ideas was missing. I got kind of gotten broken, broken down because as you say, there does, like I sensed fear. Every everything was permeated with fear and fear is a paralyzing fear as destructive, especially in a place that's supposed to be all about freedom of ideas."
"Right? And I mean, I don't know if you have anything and you thoughts to say on this whole idea of cancel culture, where people, I mean, a lot of people use is become political. So say maybe outside of the world to politics, is this, do you have, do you have thoughts about it? Does it bother you that people are sort of put in this bin and labeled as something and then thereby you can ignore everything they say and you Steven Pinker, there's a lot of Harvard folks that are fighting against, I guess, these set of ideas. But do you have, do you have thoughts?"
"In some sense, you're an inspiration that you're able to withstand the pressure, the pressure of the masses, but it is, is it's a sad, it's a sad aspect of human nature that we kind of get into these crowds and we get, we start chanting and it's fun for some reason. And then you forget yourself and then you sort of wake up the next day, not, not having anticipated the consequences of all the chanting and we will get ourselves in trouble in that. I mean, there's some responsibility on the, on social networks and the mechanisms by which they make it more frictionless to do the chanting, to do the canceling, to do the outrage and all that kind of stuff."
"So I actually on the technology side have a hope that that's fixable, but yeah, it does seem to be a w you know, it almost like the internet showed to us that we have a lot of broken ways about which we communicate with each other. And we're trying to figure that out. Same with the university, the, this mistake by Harvard showed that we need to reinvent what the university is. And I mean, all of this is it's almost like we're finding our baby deer legs and trying to strengthen the institutions that have been very successful for, for, for a long time. You know, the really interesting thing was Harvey Weinstein."
"And you choosing these exceptionally difficult cases is also thinking about what it means to defend evil people. What it means to defend these could say unpopular, and you might push back against the word word, evil, but bad people in society. First of all, do you think there's such a thing as evil, or do you think all people are good and it's just circumstances that create evil and also is there somebody to evil for the law to defend?"
Is it genetic or is it the circumstance like w w what kind of work does it do for you intellectually?
"You still put a responsibility for the, on the individual."
"Wow. That's so powerful. The constellation of bad choices, that's such a powerful way to think about sort of equality, which is the, the set of trajectories before you, that you could take, if you just roll. The dice is, you know, life has, is a kind of optimization problem. Sorry to take us into math over a set of trajectories, under imperfect information. So you're going to do a lot of stupid shit to put it in technical terms, but the, the fraction of the trajectories that take you into, into bad places or into good places is really important."
"And that's ultimately what we're talking about. An evil might be just a little bit of a predisposition biologically, but the rest is just trajectories that you can take. I miss studying Hitler a lot recently, I've been reading probably way too much. And it's, it's interesting to think about all the possible trajectories, right? That could have avoided the, this particular individual developing the hate that he did to following that he did the, the actual final. There's a few turns in him, psychologically, where he went from being a leader that just wants to conquer and to somebody who allowed his anger and emotion to take over joy, he started making mistakes for, in terms of militarily speaking, but also started doing, you know, evil things and all the possible trajectories that could have avoided that are fascinating, including he wasn't that bad at painting at a drawing."
"And it's time at Vianna. There's all these possible things to think about. And of course, as millions of others like him, that never came to power and all those kinds of things. So, but that goes to the second question on the, on the side of evil, do you think, and, and Hitler's often brought up as like an example of somebody who is like, they pin me of evil. Do you think you would, if you got that same phone call after world war II and Hitler survived during war, you know, the trial for war crimes, would you take the case defending Adolfo Hitler, if you don't want to answer that one, is there a line to draw for evil for who to not to defend?"
"That is a beautiful, ideal is difficult to think about it in the face of public pressure. It's just, I mean, it's of terrifying"
"To watch the masses during this past year of 2020 to wash the power of the masses, to make a decision before any of the data is out. If the data is ever out and you have the details and you have the processes and I, and there is an anger to the justice system. There's a lot of people that feel like, even though the ideal you describe is a beautiful one. It does not always operate justly. It does not operate to the best of its ideals. It operates unfairly. Can we go to the big picture of the criminal justice system?"
What do you given the ideal works about our criminal justice system and what is broken?
