"Let's be done. Yeah. Thanks for listening to this conversation with Michael malice and thank you to gala games, indeed better help and masterclass check them out in the description to support this podcast. And now let me leave you with some words from Jack Kerouac that perhaps begins to explain the nature of, and the reasons for my friendship with Mr. Michael malice. The only people for me are the mad ones, the ones who are mad to live Matt, to talk Matt, to be saved desirous of everything at the same time, the ones who never yawn or say commonplace thing, but burn, burn like fabulous yellow Roman candles exploding like spiders across the stars."
"And then the middle, you see the blue, central light pop. And everybody goes, thank you for listening and hope to see you next time. <inaudible>."
"This is Alex Friedman podcast and here is my conversation will Yosha Bach Thank you for once again, coming on to this particular Russian program and sticking to the theme of a Russian program, let's start with the darkest of topics"
"So this is inspired by one of your tweets. You wrote that quote when life feels unbearable, I remind myself that I'm not a person. I am a piece of software running on the brain of a random ape for a few decades. It's not the worst brain to run on. Have you experienced low points in your life? Have you experienced depression?"
So you're like a leaf floating down the river. You're just have to accept that there's a river and you just float.
How much product can we actually do of the elephant
Is the elephant consciousness in this metaphor.
"So everything outside of that consciousness is the elephant. So it's the physics of the universe, but it's also society that's outside of your,"
"So can you, is the agent a single human being? What's what, which object has agency?"
"So, but the models or the agents,"
"Still don't understand. What's the best way to think of which objects has agency with respect to human beings. Is it the body? Is it the brain? Is it the contents of the brain as agency? Like what's the actuators that you're referring to? What is the controller and where does it reside? Or is it these impossible things? Cause I keep trying to ground it to time the three-dimensional space and the one dimension of time. What's the agent in that for humans,"
"Okay. So it's hierarchies have to go to another one of your tweets with, I think you were playfully mocking Jeff Hawkins with saying his brains all the way down. So it's like it's agents all the way down it's agents made up of agents made up of agents. Like if <inaudible> Germany in Germany has made up a bunch of people and the people are themselves agents in some kind of context. And then people are made up of cells, each individual. So is it agents all the way down?"
"Can I ask you a personal question? What's the line between life and non-life is personal because you're a life form. So what do you think in this emerging complexity at which point does the things that are being, living and have agency"
"Yeah. So there's information and there's a wall to protect to, to, to maintain this disequilibrium, but isn't this very earth centric, like what you're referring to as,"
"It a so useful for conversation, but is it somehow fundamental to the university? You think there's a actual line to eventually be drawn between life and non-life or is it all kind of continuum?"
What about non-living systems? Is it also a machine? Yeah.
"Not, not only do we not know, I don't think we have the tools to see otherwise. I always worry that we, we look at the world too narrowly. Like we have, there could be life of a very different kind, right under our noses that we're just not seeing because we're not either limitations of our cognitive capacity or we're just not open-minded enough either with the tools of science or just the tools of our mind."
"Yeah. But I wonder about time, time, scale, and scale, spatial scale, whether we just need to open up our idea of what, like how life presents itself. It could be operating at a much slower timescale. Yeah. Much faster timescale. And it's almost sad to think that there's all this life around us that we're not seeing, because we're just not like thinking in terms of the right of the right scale, both time and space."
Hmm. Entities of sufficiently high complexity that are full of surprises?
I don't have a free world. So that just came out of my mouth. I'm not sure if that even makes sense. There's certain characteristics. So complexity seems to be an unnecessary property of life. And I almost want to say it has ability to do something unexpected.
Yes.
"Yeah. Increasing. I mean, there there's, there seems to be some kind of universal drive towards increasing pockets of complexity. I don't know what that is. That seems to be like a fundamental, I don't know if it's a property of the universe or it's just the consequence of the way the universe works, but there seems to be this small pockets of emergent complexity that builds on, on top of each other and starts having like greater and greater complexity by having like a hierarchy of complexity, like little organisms, building up a little society that then operates almost as an individual organism itself. And all of a sudden you have a Germany and a Merkel."
"That I feel like that's a gradual beautiful process. Like it's almost no fall is a process akin to evolution. And the way it comes down is not the same way came up. The way it comes down is usually harshly and quickly. So usually there's some kind of catastrophic,"
"But that's would that be, would you classify this as a decrease in complexity though? Yes."
"Do you have a sense of where we are? Are we on the exponential rise or we're at the peak? Are we the down slope of the, the United States empire?"
"I think that's probably the definition of like optimism and cynicism. So my nature of optimism is I think we're on the rise,"
"I think there's just all a matter of perspective. Nobody knows, but I do think that erring on the side of optimism, like you need a sufficient number, you need a minimum number of optimists in order to make that up thing actually work. And so I tend to be on the side of the optimist."
"See, I think we're a bunch of lions and tigers that have become domesticated cats. Do you use a different metaphor as I'm not exactly sure where so destructive or just softer and nicer and lazier,"
"Ones that have a lot of sex, those monkeys, not"
"You seem to have a little bit more of a structure, but it's a different, different part of the tree."
"You mentioned the elephant and the, the monkey riding the elephant and a consciousness is the monkey. And there's some prodding that the monkey gets to do. And sometimes the elephant listens. I heard you got into some content. Maybe you can correct me, but I heard you got into some contentious freewill discussions. Is this with Sam Harris or something like that? Not that I know of. Some people in club paws told me, you made a, a bunch of big debate points about freewill. Well, let me just then ask you where, where in terms of the monkey and the elephant, do you think we land in terms of the illusion of free will, how much control does the monkey have?"
"But what about for you? So is this akin to like systems like cellular automata, where it's deterministic, but when you squint your eyes a little bit, it starts to look like there's agents making decisions at the higher. So when you zoom out and look at the entities that are composed by the individual cells, even though the there's a underlying simple rules that make the system evolve in deterministic ways, it looks like there's organisms making decisions is that where the illusion of free will emerges at jump and scale"
Right? So for you then free wills and illusion.
"The another word for model is what story. So it's the story you're telling. I mean, do you actually have control? Is there a such a thing as a U and is there such a thing as you have in control? So like, are you manifesting your evolution as a, as an entity"
Okay.
"So how's that not an illusion, the story is written then, or rather we're not the writers of the story."
"No, we don't know that. When did we know that,"
"Yep. But you know, when you play video games, I understand that what's actually happening is zeros and ones inside of, inside of a computer instead of a CPU and GPU. But you're still seeing like a, the rendering of that. And you're still making decisions whether to shoot, to turn left or to turn right. If you're playing a shooter or every time it started thinking about Skyrim and elder scrolls and walking around and beautiful nature and swinging a sword, but it feels like you're making decisions inside that video game. So even though you don't have direct access in terms of perception to the, the bits, to the zeros and ones, it still feels like you're making decisions and your decisions are actually feels like they're being applied all the way down to the zeros and ones."
"So it feels like you have control, even though you don't have direct access to reality."
"Yes. But I feel like I have control inside the video game. Like the, all those like 12 year olds that kicked my ass on the internet."
How close is it to the real world though?
"Like very consistent we're we're, you're seeing a very, a crude approximation. Isn't our dream world, very consistent, like to the point of being mapped directly one-to-one to the actual physical world, as opposed to, as being completely tricked this. This is like, where you have like that."
"Yeah. So we can act in that dream world and our actions have impact in the, in the real world, in the physical world too, which we don't have access. Yeah."
"So is the software deterministic and do we not have any control? Do we have, so freewill is having a conscious, being free will, is the monkey being able to steer the elephant?"
"But it's a really good approach. It's a really good interface. And approximation equals MC squared is a good equations, are good approximation for what they're much better approximation. So to me, waves is a really nice approximation of what's all the complexity that's happening underneath. Basically it's a measure learning that is constantly"
"Are we talking about, which is the machine learning, our perception system or the dream world"
"What about the fact that like, when you're standing w with the water on your feet, and you're looking out into the vast, like open water of the ocean, and then there's a beautiful sunset and it, it, well, the fact that it's beautiful and then maybe you have like friends or loved one with you and like, you feel love. What does that as the dream world? Or what is that?"
See the word dream makes it seem like it's not real
"Only thing that's real to you is the thing that's happening at the very base of reality, like"
"So what, what do you think about Donald Hoffman's argument that it doesn't have to be consistent? The dream world to the, the, the, what he calls like the interface to the actual physical reality, where there could be evolution. I think he makes an evolutionary argument, which is like, it could be an evolutionary advantage to have the dream world drift away from physical reality."
"In some sense, humans have achieved a kind of tenure in the animal kingdom."
"Do you have a sense of what is that base layer? Physical reality? You have like a, so you have these attempts at the theories of everything. The very, very small of like strength theory or what Stephen Wolf from talks about with a hyper grass. These are these tiny, tiny, tiny, tiny objects. And then there is more like quantum mechanics. That's talking about objects that are much larger, but still very, very, very tiny. Do you have a sense of where the tiniest thing is? That is like at the lowest level, the turtle at the very bottom, you have a sense."
Yeah. That that could be just a peculiar cork of human cognition that we like discrete discrete makes sense to us. Infinity doesn't sort of in terms of our intuition.
"Hmm. How much, how important is this distinction between discrete and continuous for, for you to get to the cause? There's a, I mean, in discussion of your favorite flavor of the theory of everything, there's a few on the table. So there's string theory. There's there's particular, there's a loop quantum gravity,"
"Which focused on one particular unification. There's, there's just a bunch of favorite flavors of different people trying to propose a theory of everything, Eric Weinstein and a bunch of people throughout history. And then of course, Stephen Wolfram, who I think is one of the only people doing a discreet,"
"Yeah. He, he, he talks about that. There's the human mind can do certain mathematical things. The computer as defined by the universal Turing machine can not. Yes. What so that it has to do with infinity."
"Do you think he's right on, so let's, let's leave his discussion of consciousness aside for the moment. Do you think he's right about just what he's basically referring to as so are, is the human mind fundamentally more capable as a thinking machine than a universal toy machine? No, but so he's suggesting that, right?"
Yeah. It can do the kind of computation the machine cannot
"What about his idea? That consciousness is more, more than a computation. So it's more than something that a Turing machine can can do. So again, saying that there's something special about our mind, they cannot be replicated in a machine."
"The basic statement is there's a, there's a human experience. That includes intelligence. That includes self-awareness. That includes the hard problem of consciousness. And the question is, can that be fully simulated in the computer, in the mathematical model of the computer, as we understand it today, Roger Penrose says no. So the, the university tour machine can not simulate the universe."
"And I mean, just, just, just to linger on it, like you see, okay. Yeah. It's in the perceptual language, the multimodal perceptual language, that's the experience. That's what consciousness is within that. Well, then that model will not story, but do you, do you have agency when you play a video game, you can turn left and you can turn right in that story. So in that dream world, how much control do you have? Is there such a thing as you in that story? Like, is it right to say the main character, you know, everybody's NPCs and then there's the main character and you're controlling the main character, or is that an illusion?"
"Is there a main character that you're controlling? I'm getting to the point of like the freewill point,"
"But there's the hard problem of consciousness, which I would also, there's a subjective experience of freewill as well, that I'm not sure where the robot gets that, where that little leap is because for me right now, everything I imagine with that robot, as it gets more and more and more sophisticated, the agency comes from the programmer of the robots, still of what was programmed in,"
"If we define hyper-parameters broadly. So it's not just the S the, the parameters, the control this end to end learning system, but the entirety of the design of the robot, like the there's, you have to remove the human completely from the picture. And then in order to build the robot, you have to create an entire universe because you have to go, you can't just shortcut evolution. You have to go from the very beginning in order for it to have, because I feel like there's always a human pulling, the strings, and that makes it seem like the robot is cheating, is getting a shortcut to consciousness."
"Okay. So let's go there. Cause I got to talk to you about this. So obviously with the case of Boston dynamics, as you may or may not know, it's always either hard-coded or remote controlled, there's no intelligence."
"We have to separate several levels of discussions here. So the only thing they do is pretty sophisticated control, not with no machine learning in order to be, to maintain balance or to write itself. It's a control problem in terms of using the actuators to when it's pushed or when it steps on a thing that's uneven how to always maintain balance. And there's a tricky, like set of heuristics around that, but that's the only goal. Everything you see Boston dynamics doing in terms of that to us, humans is compelling, which is any kind of higher order movement, like turning a wiggling it's, but like, you know, jumping back and it's two feet dancing."
"The dancing is even worse because dancing is hard coded in it's it's choreographed by humans, this choreography software. So like there is no of all that high level movement. There's no anything that you can call, certainly can't call AI, but there's no even like basic heuristics, it's all hard coded in. And yet we humans immediately project agency onto them, which is"
"So those two layers are separate the, the thing, the higher level instruction of what, how you should move and where you should move."
"Right. But see, it doesn't feel like freewill. Okay."
"I just don't know how big of a leap it is to start create a system. That's able to tell stories within stories like how big of a leap that is we're currently Boston dynamics is, or any robot that's operating in the physical space that, and that lead might be big if it requires to solve the hard problem of consciousness, which is telling a hell of a good story, right?"
"I, yeah, I think I would need to get into details because I think the way he uses the word consciousness is more kin to like, self-awareness like modeling yourself within the world, as opposed to the subjective experience. The hard problem."
"We are the thing that pays attention. Right. I don't see where the awareness that we're aware, the, the heart problem doesn't feel like it's solved. I mean, there, there, there it's called a hard problem for a reason, because it seems like there needs to be a major leap."
A space exist inside the story. Okay. So your consciousness
"So what about the perception of consciousness? So to me, you look conscious. So the illusion of cautiousness, the demonstration of consciousness, I asked for the, the leg of robot, how do we make this leg of the robot conscious? So there's two things, and maybe you can tell me if they're neighboring ideas. One is actually making a conscious and the other is make it appear conscious to others. Are those related,"
"But then I can come back to a conscious state. Okay. I particularly I'm referring to the social aspect that the demonstration of consciousness is a really nice thing at a party when you're trying to meet a new person. It's a nice thing to, to, to know that they're conscious and they can, I dunno how fundamental consciousness is in human interaction, but it seems like to be at least an important part. And I, I asked that in the same kind of way for robots, you know, in order to create a rich, compelling human robot interaction, it feels like there needs to be elements of consciousness within that interaction."
"The question is, how hard is it for the robot artificially created robot to achieve cat level and party tricks? Yes."
So you need the unified model to do the party
"So what's the process. Would you save engineering consciousness in the machine? Like a, what are the ideas here?"
"You build a very accurate prediction mechanism that is step one of the perception. So first you predict, then you perceive and see the error in your prediction."
"So you're, you're talking about building a hell of an awesome perception system. That's able to do prediction and perception and correct. Then"
"And you were saying, the motivational system is some kind of like, what is it, a high level narrative over some lows?"
"Like motivational system, like the lower level stuff like hungry. Yes."
So cautiousness the index
"And the memory database. Okay. But let me sneak up to the questions of consciousness a little further. So we usually relate suffering to consciousness. So the capacity to suffer, I think to me, that's a really strong sign of consciousness is a thing that can suffer. How, how is that useful suffering? And like in your model where you just described, which is indexing of memories and what does it coherence with the perception with this predictive thing that's going on in the perception?"
"How, how does the suffering relate to any of that? You know, the higher level suffering that humans do,"
"So at least to grow with you adding extra layers it's okay. Do your cognition, let me ask you then, cause I guess take on suffering the ethics of the whole thing. So not our consciousness, but the consciousness of others you've tweeted. One of my biggest fears is that insects could be conscious. The amount of suffering on earth would be unthinkable. So when we think of other conscious beings is suffering a property of consciousness that we're most concerned about."
"So I'm still thinking about robots, how to make sense of other non-human things that appear to have the depth of experience that humans have. And to me, that means consciousness and the darkest side of that, which is suffering the capacity to suffer. And so I started thinking how much responsibility do we have for those other conscious beings? That's where the, the definition of consciousness becomes most urgent, like having to come up with a definition of cautious because the most urgent is who should we, and should we not be torturing?"
"Well, he, he drew, he drew a line somewhere where this is us and that's them, it's the circle of empathy. It's like these, you don't have to use the word consciousness, but these are the things that matter to me if they suffer or not. And these are the things that don't."
I see. So like different societies throughout history put different value on the
"Even the, the objective of avoiding suffering. Like some societies probably. I mean, this is where like religious belief really helps that, that afterlife, that doesn't matter that you suffer or die will matters as you suffer honorably, right? So that you enter the afterlife."
"Somebody who who's saying, we live in a dream world, zero evidence for anything. So it's okay."
"Just because we live in a dream world, doesn't mean mathematics can give us a consistent glimpse of physical of objective."
"Can I ask you on a small tangent to talk about your favorite set of ideas and people which is postmodernism,"
"What is, what is postmodernism? How would you define it and why to you? Is it not a useful framework of thought?"
It becomes. Yeah. It becomes a political weapon of sorts. Yeah.
"Right? You have to acknowledge the ideological part of any movement actually, including postmodernism."
"Right? So, I mean, there's certain properties to an ideology that make it harmful. One of them is that like dogmatism of just certainty, dog-eared certainty in that you're right. You have the truth and nobody else knows"
"Can I ask you about substances chemical substances that affect the video game, the dream world. So psychedelics that increasing have been getting a lot of research done on them. So in general, psychedelics psilocybin, MGMA, but also really interesting one, the big one, which is DMT, what, and where are the places that these substances take the mind that is operating in the dream world? Do you have an interesting sense how this throws a wrinkle into the prediction model? Is it just some weird little quirk or is there, is there some fundamental expansion of the mind going on?"
"W what is it about psychedelics that forces that I thought it would be the opposite? I thought, I thought that is, it's a good mechanism for, for generalization, for regularization. So it feels like psychedelics expansion of the mind, like taking you outside of like forcing your model to be a non predictive is a good thing. Meaning like, it's, it's almost like, okay, what I would say psychedelics are akin to is traveling to a totally different environment like going, if you've never been to like India or something like that from the United States, very different set of people, different culture, different food, different roads, and values and all those kinds of things."
"Yeah. But doesn't give you a fresh perspective on the physical reality. Who's making that sound is inside my head, or is it external?"
"Yeah. In the physical reality, there's there's sound waves traveling through air. Okay. That's our model of what's happened, how it happened, right. It doesn't the dose psychedelics give you a fresh perspective on this physical reality, like on not this physical reality, but this, this more w what do you call it? The dream world that's mapped directly."
"Oh, isn't it another trickier form of data augmentation."
"I, I think I'm over applying the metaphor of a neural network in my own mind, which I just think that doesn't lead to over-fitting. Right. But, but you were just sort of anecdotally saying my experiences with people that have done psychedelics or that, that, that kind of quality,"
"What you mean by overfitting? Now there's a lot of interpretation to the term overfitting in this case, but I got you. So he was getting, he was getting a positive rewards from a lot of actions."
"I wonder, you know, there's a question of correlation versus causation. And also wonder if it's the psychedelics, or if it's more the social, like being the outsider and having a strong community of, of outside and being, having a leadership position in and outside of cult-like community that could have a much stronger effect of over-fitting than do psychedelics themselves. They actual substances because it's a counterculture thing. So it could be that as opposed to the actual substance, if you're a boring person who wears a suit and tie and works at a bank and take psychedelics, that could be a very different effect of psychedelics on, on your mind."
